{
  "source": {
    "title": "Chronic Obstructive Pulmonary Disease: Diagnosis and Management",
    "organization": "American Academy of Family Physicians",
    "document_type": "chronic_guideline",
    "publication_year": 2017,
    "version_number": "",
    "doi": "",
    "file_name": "3.pdf"
  },
  "classification": {
    "engine_used": "ChronicRiskEngine",
    "document_type": "chronic_guideline",
    "confidence": 0.9,
    "signals": [
      "monotherapy with inhaled bronchodilator, stepping up to combination therapy",
      "Pharmacotherapy and smoking cessation are the mainstays of treatment",
      "long-term oxygen therapy, and surgery may be considered",
      "adding inhaled corticosteroids as symptom severity and airflow obstruction progress",
      "pulmonary rehabilitation"
    ],
    "body_systems": [
      "respiratory"
    ]
  },
  "extraction": {
    "summary": "Chronic obstructive pulmonary disease (COPD) should be suspected in patients with risk factors (primarily smoking history) who report dyspnea, chronic cough, or wheezing history. Diagnosis must be confirmed by spirometry showing post-bronchodilator FEV1/FVC ratio <0.7. Treatment focuses on smoking cessation and pharmacotherapy with inhaled bronchodilators, stepping up to combination therapy and adding inhaled corticosteroids as severity progresses.",
    "population": {
      "age_criteria": "Age older than 35-45 years with significant smoking history",
      "risk_criteria": "Smoking history >40 pack-years (strong predictor), α-antitrypsin deficiency, significant exposure to indoor/outdoor air pollution, occupational dusts, or chemicals",
      "disease_definition": "Post-bronchodilator FEV1/FVC ratio <0.7 confirmed by spirometry",
      "exclusions": "Asthma, bronchiectasis, congestive heart failure, cystic fibrosis, interstitial lung disease, lung cancer, tuberculosis",
      "severity_staging": "GOLD 1 (mild, FEV1 ≥80%), GOLD 2 (moderate, 50-79%), GOLD 3 (severe, 30-49%), GOLD 4 (very severe, <30%)"
    },
    "key_thresholds": [
      {
        "parameter": "FEV1/FVC ratio",
        "value": "0.7",
        "unit": "ratio",
        "context": "Diagnostic threshold for COPD"
      },
      {
        "parameter": "Peak flow rate",
        "value": "350",
        "unit": "L/min",
        "context": "Clinical predictor threshold"
      },
      {
        "parameter": "Smoking history",
        "value": "30-40",
        "unit": "pack-years",
        "context": "Clinical prediction thresholds"
      },
      {
        "parameter": "Oxygen saturation",
        "value": "88-92",
        "unit": "%",
        "context": "Target range for oxygen therapy"
      },
      {
        "parameter": "Arterial PaO2",
        "value": "55",
        "unit": "mmHg",
        "context": "Threshold for long-term oxygen therapy"
      },
      {
        "parameter": "Arterial partial pressure of oxygen (PaO2)",
        "value": "55",
        "unit": "mm Hg",
        "context": "Threshold for long-term oxygen therapy indication"
      },
      {
        "parameter": "Target oxygen saturation during therapy",
        "value": "88-92",
        "unit": "%",
        "context": "Treatment target range"
      },
      {
        "parameter": "FEV1",
        "value": "50",
        "unit": "% of predicted",
        "context": "Threshold for pulmonary rehabilitation recommendation"
      }
    ],
    "recommendations": [
      {
        "recommendation": "Start monotherapy with inhaled bronchodilator (LABA or long-acting anticholinergic)",
        "strength": "Strong",
        "evidence_level": "A",
        "notes": "First-line treatment for symptomatic patients"
      },
      {
        "recommendation": "Smoking cessation for all patients who smoke",
        "strength": "Strong",
        "evidence_level": "A",
        "notes": "Reduces FEV1 decline and mortality"
      },
      {
        "recommendation": "Add inhaled corticosteroids for FEV1 <50% predicted or frequent exacerbations",
        "strength": "Strong",
        "evidence_level": "A",
        "notes": "Typically for GOLD C or D classification"
      },
      {
        "recommendation": "Long-term oxygen therapy for severe resting hypoxia (PaO2 ≤55 mmHg or O2 sat ≤88%)",
        "strength": "Strong",
        "evidence_level": "A",
        "notes": "Use at least 15 hours per day"
      },
      {
        "recommendation": "Avoid screening for COPD in asymptomatic patients",
        "strength": "Strong",
        "evidence_level": "B",
        "notes": "Per ACP, GOLD, USPSTF guidelines"
      },
      {
        "recommendation": "Long-term oxygen therapy for patients with severe resting hypoxia (PaO2 ≤55 mm Hg or oxygen saturation ≤88%)",
        "strength": "Strong",
        "evidence_level": "A",
        "notes": "Use at least 15 hours per day"
      },
      {
        "recommendation": "Pulmonary rehabilitation for symptomatic patients with FEV1 <50% of predicted",
        "strength": "Strong",
        "evidence_level": "A",
        "notes": "Requires at least 6 months to achieve benefits"
      },
      {
        "recommendation": "Monotherapy with long-acting beta agonist or long-acting anticholinergic for symptomatic patients with FEV1 <60% of predicted",
        "strength": "Strong",
        "evidence_level": "A",
        "notes": "Choice based on patient preference, cost, and adverse effects"
      },
      {
        "recommendation": "Annual influenza vaccination",
        "strength": "Not specified",
        "evidence_level": "Not specified",
        "notes": "Can reduce COPD exacerbations"
      },
      {
        "recommendation": "Pneumococcal vaccination (PPSV23 and PCV13 one year apart)",
        "strength": "Not specified",
        "evidence_level": "Not specified",
        "notes": "For patients 19-64 years who smoke or have COPD"
      }
    ],
    "medications": [
      {
        "drug": "Tiotropium (Spiriva)",
        "dose": "One puff daily",
        "indication": "Long-acting anticholinergic bronchodilator",
        "class": "Anticholinergic"
      },
      {
        "drug": "Albuterol",
        "dose": "2-4mg orally 2-3 times daily",
        "indication": "Short-acting beta2 agonist",
        "class": "Beta2 agonist"
      },
      {
        "drug": "Formoterol",
        "dose": "One puff twice daily",
        "indication": "Long-acting beta2 agonist",
        "class": "Beta2 agonist"
      },
      {
        "drug": "Budesonide/formoterol (Symbicort)",
        "dose": "Two puffs twice daily",
        "indication": "Combination corticosteroid/LABA",
        "class": "Corticosteroid/Beta2 agonist"
      },
      {
        "drug": "Roflumilast (Daliresp)",
        "dose": "500mcg daily",
        "indication": "Adjunctive therapy for refractory symptoms",
        "class": "Phosphodiesterase-4 inhibitor"
      },
      {
        "drug": "Roflumilast",
        "dose": "Not specified",
        "indication": "Adjunctive therapy, not as bronchodilator",
        "class": "PDE4 inhibitor"
      },
      {
        "drug": "Theophylline",
        "dose": "Not specified",
        "indication": "Severe refractory symptoms only",
        "class": "Methylxanthine"
      },
      {
        "drug": "Long-acting beta agonists",
        "dose": "Not specified",
        "indication": "Symptomatic patients with FEV1 <60% predicted",
        "class": "LABA"
      },
      {
        "drug": "Long-acting anticholinergics",
        "dose": "Not specified",
        "indication": "Symptomatic patients with FEV1 <60% predicted",
        "class": "LAMA"
      }
    ],
    "red_flags": [
      "Acute exacerbation with severe dyspnea",
      "Hemoptysis",
      "Chest pain",
      "Signs of respiratory failure",
      "Cardiovascular events with short-acting anticholinergics",
      "Asthma-related symptoms with LABA monotherapy",
      "Pneumonia symptoms with inhaled corticosteroids",
      "Severe resting hypoxia (PaO2 ≤55 mm Hg or oxygen saturation ≤88%)",
      "Cor pulmonale or signs of tissue hypoxia",
      "Nocturnal oxygen saturation ≤88%",
      "Exercise hypoxemia with PaO2 ≤55 mm Hg or oxygen saturation ≤88%"
    ],
    "follow_up": "Periodic evaluation for hypoxemia in moderate to severe COPD patients. Monitor spirometry for disease progression. Assess symptom control and medication effectiveness regularly.",
    "escalation_path": "Escalate to pulmonologist for: severe refractory symptoms, consideration of pulmonary rehabilitation, lung transplant evaluation, or complex medication management. Consider hospitalization for severe exacerbations or respiratory failure.",
    "_chunked_extraction": true,
    "_chunks_merged": 2
  },
  "metadata": {
    "run_id": "500a3ed4",
    "extracted_at": "2026-03-04T07:17:34.537979Z",
    "engine_version": "guideline_extractor_v2.3",
    "modules_activated": [
      "disease_definition",
      "diagnostic_thresholds",
      "risk_stratification",
      "escalation_ladder",
      "medication_management",
      "monitoring_schedule"
    ],
    "validation_passed": true,
    "validation_warnings": [],
    "raw_text_chars": 42031
  }
}