{
  "source": {
    "title": "Adhesive Capsulitis: Diagnosis and Management",
    "organization": "American Family Physician",
    "document_type": "chronic_guideline",
    "publication_year": 2019,
    "version_number": "",
    "doi": "",
    "file_name": "12.pdf"
  },
  "classification": {
    "engine_used": "ChronicRiskEngine",
    "document_type": "chronic_guideline",
    "confidence": 0.8,
    "signals": [
      "The most effective treatment for adhesive capsulitis is uncertain",
      "Nonsurgical treatments include nonsteroidal anti-inflammatory drugs, short-term oral corticosteroids",
      "Surgical treatment options for patients who have minimal improvement after six to 12 weeks",
      "can persist for years with some patients never regaining full function",
      "Physiotherapy and corticosteroid injections combined may provide greater improvement"
    ],
    "body_systems": [
      "musculoskeletal"
    ]
  },
  "extraction": {
    "summary": "Adhesive capsulitis (frozen shoulder) is a common shoulder condition characterized by pain and decreased range of motion, especially in external rotation, with increased prevalence in patients with diabetes mellitus and hypothyroidism. Recent evidence suggests persistent functional limitations if left untreated, challenging the traditional theory of complete self-resolution within 1-2 years.",
    "population": {
      "age_criteria": "40-60 years of age",
      "risk_criteria": "Female gender, diabetes mellitus (5x increased risk), hypothyroidism (27.2% vs 10.7% prevalence)",
      "disease_definition": "Pathologic process with contracture of the glenohumeral capsule presenting as pain, stiffness, and dysfunction of the affected shoulder",
      "exclusions": "Fever, night sweats, malaise, unexplained weight loss (suggesting neoplasm or autoimmune disease), neuropathic symptoms (suggesting cervical radiculopathy)",
      "severity_staging": "Not specified in document"
    },
    "key_thresholds": [
      {
        "parameter": "General population prevalence",
        "value": "2-5",
        "unit": "percent",
        "context": "Estimated prevalence of adhesive capsulitis"
      },
      {
        "parameter": "Diabetes prevalence in adhesive capsulitis patients",
        "value": "30",
        "unit": "percent",
        "context": "95% CI: 24-37%"
      }
    ],
    "recommendations": [
      {
        "recommendation": "Consider testing persons with adhesive capsulitis for diabetes mellitus or hypothyroidism",
        "strength": "Conditional",
        "evidence_level": "C",
        "notes": "Based on increased association with these conditions"
      },
      {
        "recommendation": "The combination of physiotherapy and corticosteroid injection may provide greater symptom improvement than physiotherapy alone",
        "strength": "Conditional",
        "evidence_level": "B",
        "notes": "May provide greater improvement than physiotherapy alone"
      },
      {
        "recommendation": "The combination of hydrodilatation and corticosteroid injection may expedite recovery of pain free range of motion compared with corticosteroid injection alone",
        "strength": "Conditional",
        "evidence_level": "B",
        "notes": "Greatest benefit experienced within first three months"
      }
    ],
    "medications": [
      {
        "drug": "NSAIDs",
        "dose": "Not specified",
        "indication": "Pain relief",
        "class": "Nonsteroidal anti-inflammatory drugs"
      },
      {
        "drug": "Oral corticosteroids",
        "dose": "Not specified",
        "indication": "Short-term use only (less than 6 weeks) for pain relief",
        "class": "Corticosteroids"
      },
      {
        "drug": "Intra-articular corticosteroids",
        "dose": "Not specified",
        "indication": "Pain relief and improved function",
        "class": "Corticosteroids"
      }
    ],
    "red_flags": [
      "Fever, night sweats, malaise, or unexplained weight loss",
      "Neuropathic symptoms",
      "Focal tenderness (suggests alternative diagnosis)",
      "Dyspnea or cough (if Pancoast tumor suspected)"
    ],
    "follow_up": "Assessment at 6-12 weeks to determine response to nonsurgical treatment",
    "escalation_path": "Referral to orthopedic surgeon for patients with minimal improvement after 6-12 weeks of nonsurgical treatment and who cannot tolerate symptoms. Surgical options include manipulation under anesthesia and arthroscopic capsule release.",
    "_chunked_extraction": true,
    "_chunks_merged": 1
  },
  "metadata": {
    "run_id": "d9336599",
    "extracted_at": "2026-03-04T07:06:57.767260Z",
    "engine_version": "guideline_extractor_v2.3",
    "modules_activated": [
      "disease_definition",
      "diagnostic_thresholds",
      "risk_stratification",
      "escalation_ladder",
      "medication_management",
      "monitoring_schedule"
    ],
    "validation_passed": true,
    "validation_warnings": [],
    "raw_text_chars": 19169
  }
}