{
  "source": {
    "title": "Oncologic Emergencies: Recognition and Initial Management",
    "organization": "",
    "document_type": "acute_protocol",
    "publication_year": null,
    "version_number": "",
    "doi": "",
    "file_name": "1.pdf"
  },
  "classification": {
    "engine_used": "AcuteProtocolEngine",
    "document_type": "acute_protocol",
    "confidence": 0.95,
    "signals": [
      "oncologic emergencies",
      "stabilization is focused on",
      "requires inpatient therapy with rapid administration",
      "usually requires inpatient therapy",
      "rapid, acute cell lysis"
    ],
    "body_systems": [
      "hematologic",
      "metabolic",
      "cardiovascular",
      "neurologic",
      "respiratory"
    ]
  },
  "extraction": {
    "summary": "Oncologic emergencies can be classified as metabolic, hematologic, structural, or treatment-related conditions requiring urgent recognition and management. Early stabilization and subspecialty referral are often necessary to prevent devastating outcomes including paralysis and death.",
    "population": {
      "age_criteria": "Not specified",
      "risk_criteria": "Cancer patients, particularly those receiving chemotherapy, radiation therapy, or immunotherapy",
      "disease_definition": "Acute life-threatening complications in cancer patients categorized as metabolic, hematologic, structural, or treatment-related",
      "exclusions": "None specified",
      "severity_staging": "Ranges from insidious development over months to acute presentations over hours"
    },
    "key_thresholds": [
      {
        "parameter": "Serum calcium",
        "value": ">10.5",
        "unit": "mg/dL",
        "context": "Hypercalcemia of malignancy"
      },
      {
        "parameter": "Temperature",
        "value": "≥101.3",
        "unit": "°F",
        "context": "Febrile neutropenia - single measurement"
      },
      {
        "parameter": "Absolute neutrophil count",
        "value": "<500",
        "unit": "cells/mm³",
        "context": "Febrile neutropenia"
      },
      {
        "parameter": "Sodium",
        "value": "<135",
        "unit": "mEq/L",
        "context": "SIADH hyponatremia"
      },
      {
        "parameter": "Serum viscosity",
        "value": ">4",
        "unit": "cP",
        "context": "Hyperviscosity syndrome"
      },
      {
        "parameter": "Calcium",
        "value": "≤7.0",
        "unit": "mg/dL",
        "context": "Tumor lysis syndrome"
      },
      {
        "parameter": "Potassium",
        "value": "≥6.0",
        "unit": "mEq/L",
        "context": "Tumor lysis syndrome"
      },
      {
        "parameter": "Uric acid",
        "value": "≥8.0",
        "unit": "mg/dL",
        "context": "Tumor lysis syndrome"
      },
      {
        "parameter": "Pulsus paradoxus",
        "value": "77",
        "unit": "percent",
        "context": "Present in tamponade cases"
      },
      {
        "parameter": "Pulsus paradoxus in malignant effusions",
        "value": "30",
        "unit": "percent",
        "context": "Present in malignant pericardial effusions"
      }
    ],
    "recommendations": [
      {
        "recommendation": "Emergent use of antibiotics in febrile neutropenia (within 30 minutes of presentation)",
        "strength": "Strong",
        "evidence_level": "B",
        "notes": "Improves survival rates"
      },
      {
        "recommendation": "Evaluate new-onset back pain in cancer patients as epidural spinal cord compression until ruled out",
        "strength": "Strong",
        "evidence_level": "C",
        "notes": "Treatment delay can lead to permanent paralysis"
      },
      {
        "recommendation": "Use permanent surgical solutions for malignant pericardial effusions",
        "strength": "Moderate",
        "evidence_level": "B",
        "notes": "Pericardial windows and indwelling catheters superior to pericardiocentesis alone"
      },
      {
        "recommendation": "Vigorous rehydration and maintain urine output for tumor lysis syndrome",
        "strength": "Strong",
        "evidence_level": "C",
        "notes": "Focus on stabilization with uric acid reduction"
      },
      {
        "recommendation": "Concurrent palliative care consultation at time of cancer diagnosis",
        "strength": "Moderate",
        "evidence_level": "C",
        "notes": "Team-based approach recommended"
      },
      {
        "recommendation": "Concurrent palliative care consultation should be offered to patients with cancer at the time of diagnosis",
        "strength": "C",
        "evidence_level": "Consensus, expert opinion",
        "notes": "Early palliative care integration"
      },
      {
        "recommendation": "Emergent use of antibiotics in patients with cancer who present with febrile neutropenia improves survival rates",
        "strength": "B",
        "evidence_level": "Limited-quality patient-oriented evidence",
        "notes": "Time to antibiotic administration impacts mortality"
      },
      {
        "recommendation": "New-onset back pain in patients with cancer should be evaluated as epidural spinal cord compression until it is ruled out",
        "strength": "C",
        "evidence_level": "Consensus, expert opinion",
        "notes": "High index of suspicion required"
      },
      {
        "recommendation": "More permanent surgical solutions for management of malignant pericardial effusions, such as pericardial windows and indwelling pericardial catheters, are associated with improved patient outcomes compared with percutaneous pericardiocentesis alone",
        "strength": "B",
        "evidence_level": "Limited-quality patient-oriented evidence",
        "notes": "Better long-term outcomes than pericardiocentesis alone"
      }
    ],
    "medications": [
      {
        "drug": "Furosemide",
        "dose": "Not specified",
        "indication": "Hypercalcemia of malignancy - diuresis after rehydration",
        "class": "Loop diuretic"
      },
      {
        "drug": "IV bisphosphonates",
        "dose": "Not specified",
        "indication": "Hypercalcemia of malignancy",
        "class": "Bone resorption inhibitor"
      },
      {
        "drug": "Denosumab",
        "dose": "Not specified",
        "indication": "Hypercalcemia of malignancy",
        "class": "Monoclonal antibody"
      },
      {
        "drug": "Hypertonic saline",
        "dose": "Not specified",
        "indication": "Rapid-onset severe hyponatremia in SIADH",
        "class": "Electrolyte replacement"
      },
      {
        "drug": "Tolvaptan",
        "dose": "Not specified",
        "indication": "SIADH",
        "class": "Vasopressin V2 receptor antagonist"
      },
      {
        "drug": "Empiric antibiotics",
        "dose": "Not specified",
        "indication": "Febrile neutropenia",
        "class": "Antimicrobial"
      },
      {
        "drug": "Steroids",
        "dose": "Not specified",
        "indication": "Malignant epidural spinal cord compression, superior vena cava syndrome",
        "class": "Corticosteroid"
      },
      {
        "drug": "Antibiotics",
        "dose": "Not specified",
        "indication": "Febrile neutropenia",
        "class": "Anti-infective"
      },
      {
        "drug": "Probiotics containing Lactobacillus",
        "dose": "Not specified",
        "indication": "Prevention of chemotherapy/radiation-induced diarrhea",
        "class": "Probiotic"
      }
    ],
    "red_flags": [
      "New-onset back pain in cancer patients, especially worse when lying down",
      "Facial edema with collateral venous circulation",
      "Temperature ≥101.3°F with neutropenia",
      "Rapid neurologic decline or motor deficits",
      "Beck triad: muffled heart sounds, hypotension, increased JVP",
      "Spontaneous bleeding with neurologic deficits",
      "Progressive decline in mental function with hypercalcemia",
      "Severe electrolyte abnormalities after cancer treatment",
      "Pulsus paradoxus in cancer patients",
      "New-onset back pain in cancer patients (possible spinal cord compression)",
      "Febrile neutropenia requiring emergent antibiotics",
      "Beck triad: muffled heart sounds, hypotension, increased jugular venous pressure",
      "Life-threatening pneumonitis from immunotherapy",
      "Life-threatening pancreatitis from immunotherapy"
    ],
    "follow_up": "Inpatient monitoring until stabilization achieved, with specific parameters: afebrile 48-72 hours and ANC >500 cells/mm³ for febrile neutropenia; euvolemia achievement for hypercalcemia; correction of electrolyte abnormalities for tumor lysis syndrome",
    "escalation_path": "Immediate oncology consultation for all emergencies; nephrology for tumor lysis syndrome and severe renal insufficiency requiring hemodialysis; neurosurgery for epidural spinal cord compression; cardiothoracic surgery for superior vena cava syndrome and pericardial effusions; hematology for hyperviscosity syndrome; infectious disease for febrile neutropenia; palliative care consultation recommended for advanced disease",
    "_chunked_extraction": true,
    "_chunks_merged": 2
  },
  "metadata": {
    "run_id": "4d178540",
    "extracted_at": "2026-03-04T07:05:39.556692Z",
    "engine_version": "guideline_extractor_v2.3",
    "modules_activated": [
      "urgency_triage",
      "stabilization_steps",
      "critical_thresholds",
      "emergency_medications",
      "escalation_triggers",
      "disposition"
    ],
    "validation_passed": true,
    "validation_warnings": [],
    "raw_text_chars": 37572
  }
}